Service,Resource Type,Operation Name,Activity Type,Description,Origin,IsDataAction
Microsoft Security,Security Connectors DevOps AzureDevOpsOrgs Projects Repos,AzureDevOpsRepos_List,Microsoft.Security/securityConnectors/devops/azureDevOpsOrgs/projects/repos/read,Returns a list of Azure DevOps repositories onboarded to the connector.,user,False
Microsoft Security,Security Connectors DevOps AzureDevOpsOrgs Projects Repos,AzureDevOpsRepos_Update,Microsoft.Security/securityConnectors/devops/azureDevOpsOrgs/projects/repos/write,Updates a monitored Azure DevOps repository resource.,user,False
Microsoft Security,Security Connectors DevOps GitHubOwners,GitHubOwners_CreateOrUpdate,Microsoft.Security/securityConnectors/devops/gitHubOwners/write,Creates or updates a monitored GitHub owner.,user,False
Microsoft Security,Security Connectors DevOps GitHubOwners,GitHubOwners_Delete,Microsoft.Security/securityConnectors/devops/gitHubOwners/delete,Deletes a monitored GitHub owner.,user,False
Microsoft Security,Security Connectors DevOps GitHubOwners,GitHubOwners_Get,Microsoft.Security/securityConnectors/devops/gitHubOwners/read,Returns a monitored GitHub owner.,user,False
Microsoft Security,Security Connectors DevOps GitHubOwners,GitHubOwners_List,Microsoft.Security/securityConnectors/devops/gitHubOwners/read,Returns a list of GitHub owners onboarded to the connector.,user,False
Microsoft Security,Security Connectors DevOps GitHubOwners,GitHubOwners_Update,Microsoft.Security/securityConnectors/devops/gitHubOwners/write,Updates a monitored GitHub owner.,user,False
Microsoft Security,Security Connectors DevOps GitHubOwners ListAvailableRepos,GitHubRepos_ListAvailable,Microsoft.Security/securityConnectors/devops/gitHubOwners/listAvailableRepos/action,Returns a list of all GitHub repositories accessible by the user token and app installation used by the connector.,user,False
Microsoft Security,Security Connectors DevOps GitHubOwners Repos,GitHubRepos_CreateOrUpdate,Microsoft.Security/securityConnectors/devops/gitHubOwners/repos/write,Creates or updates a monitored GitHub repository.,user,False
Microsoft Security,Security Connectors DevOps GitHubOwners Repos,GitHubRepos_Delete,Microsoft.Security/securityConnectors/devops/gitHubOwners/repos/delete,Deletes a monitored GitHub repository.,user,False
Microsoft Security,Security Connectors DevOps GitHubOwners Repos,GitHubRepos_Get,Microsoft.Security/securityConnectors/devops/gitHubOwners/repos/read,Returns a monitored GitHub repository.,user,False
Microsoft Security,Security Connectors DevOps GitHubOwners Repos,GitHubRepos_List,Microsoft.Security/securityConnectors/devops/gitHubOwners/repos/read,Returns a list of GitHub repositories onboarded to the connector.,user,False
Microsoft Security,Security Connectors DevOps GitHubOwners Repos,GitHubRepos_Update,Microsoft.Security/securityConnectors/devops/gitHubOwners/repos/write,Updates a monitored GitHub repository.,user,False
Microsoft Security,Security Connectors DevOps GitLabGroups,GitLabGroups_CreateOrUpdate,Microsoft.Security/securityConnectors/devops/gitLabGroups/write,Creates or updates monitored GitLab Group details.,user,False
Microsoft Security,Security Connectors DevOps GitLabGroups,GitLabGroups_Delete,Microsoft.Security/securityConnectors/devops/gitLabGroups/delete,Deletes a monitored GitLab Group.,user,False
Microsoft Security,Security Connectors DevOps GitLabGroups,GitLabGroups_Get,Microsoft.Security/securityConnectors/devops/gitLabGroups/read,Returns a monitored GitLab Group resource for a given fully-qualified name.,user,False
Microsoft Security,Security Connectors DevOps GitLabGroups,GitLabGroups_List,Microsoft.Security/securityConnectors/devops/gitLabGroups/read,Returns a list of GitLab groups onboarded to the connector.,user,False
Microsoft Security,Security Connectors DevOps GitLabGroups,GitLabGroups_Update,Microsoft.Security/securityConnectors/devops/gitLabGroups/write,Updates monitored GitLab Group details.,user,False
Microsoft Security,Security Connectors DevOps GitLabGroups ListAvailableProjects,GitLabProjects_ListAvailable,Microsoft.Security/securityConnectors/devops/gitLabGroups/listAvailableProjects/action,Gets a list of all GitLab projects that are directly owned by given group and accessible by the user token consumed by the connector.,user,False
Microsoft Security,Security Connectors DevOps GitLabGroups ListAvailableSubgroups,GitLabSubgroups_ListAvailable,Microsoft.Security/securityConnectors/devops/gitLabGroups/listAvailableSubgroups/action,Gets all nested subgroups of given GitLab Group which are accessible by the user token consumed by the connector.,user,False
Microsoft Security,Security Connectors DevOps GitLabGroups ListSubgroups,GitLabSubgroups_List,Microsoft.Security/securityConnectors/devops/gitLabGroups/listSubgroups/action,Gets nested subgroups of given GitLab Group which are onboarded to the connector.,user,False
Microsoft Security,Security Connectors DevOps GitLabGroups Projects,GitLabProjects_CreateOrUpdate,Microsoft.Security/securityConnectors/devops/gitLabGroups/projects/write,Creates or updates monitored GitLab Project details.,user,False
Microsoft Security,Security Connectors DevOps GitLabGroups Projects,GitLabProjects_Delete,Microsoft.Security/securityConnectors/devops/gitLabGroups/projects/delete,Deletes a monitored GitLab Project.,user,False
Microsoft Security,Security Connectors DevOps GitLabGroups Projects,GitLabProjects_Get,Microsoft.Security/securityConnectors/devops/gitLabGroups/projects/read,Returns a monitored GitLab Project resource for a given fully-qualified group name and project name.,user,False
Microsoft Security,Security Connectors DevOps GitLabGroups Projects,GitLabProjects_List,Microsoft.Security/securityConnectors/devops/gitLabGroups/projects/read,Gets a list of GitLab projects that are directly owned by given group and onboarded to the connector.,user,False
Microsoft Security,Security Connectors DevOps GitLabGroups Projects,GitLabProjects_Update,Microsoft.Security/securityConnectors/devops/gitLabGroups/projects/write,Updates monitored GitLab Project details.,user,False
Microsoft Security,Security Connectors DevOps ListAvailableAzureDevOpsOrgs,AzureDevOpsOrgs_ListAvailable,Microsoft.Security/securityConnectors/devops/listAvailableAzureDevOpsOrgs/action,Returns a list of all Azure DevOps organizations accessible by the user token consumed by the connector.,user,False
Microsoft Security,Security Connectors DevOps ListAvailableGitHubOwners,GitHubOwners_ListAvailable,Microsoft.Security/securityConnectors/devops/listAvailableGitHubOwners/action,Returns a list of all GitHub owners accessible by the user token consumed by the connector.,user,False
Microsoft Security,Security Connectors DevOps ListAvailableGitLabGroups,GitLabGroups_ListAvailable,Microsoft.Security/securityConnectors/devops/listAvailableGitLabGroups/action,Returns a list of all GitLab groups accessible by the user token consumed by the connector.,user,False
Microsoft Security,Security Connectors DevOps OperationResults,OperationResults_Get,Microsoft.Security/securityConnectors/devops/operationResults/read,Get devops long running operation result.,user,False
Microsoft Security,Security Contact,Delete security contact,Microsoft.Security/securityContacts/delete,Deletes the security contact,user,False
Microsoft Security,Security Contact,Get security contact,Microsoft.Security/securityContacts/read,Gets the security contact,user,False
Microsoft Security,Security Contact,Update security contact,Microsoft.Security/securityContacts/write,Updates the security contact,user,False
Microsoft Security,Security Policy,Get security policy,Microsoft.Security/policies/read,Gets the security policy,user,False
Microsoft Security,Security Policy,Update security policy,Microsoft.Security/policies/write,Updates the security policy,user,False
Microsoft Security,Security Recommendations,Activate Recommendation,Microsoft.Security/locations/tasks/activate/action,Activate a security recommendation,user,False
Microsoft Security,Security Recommendations,Dismiss Recommendation,Microsoft.Security/locations/tasks/dismiss/action,Dismiss a security recommendation,user,False
Microsoft Security,Security Recommendations,Get security recommendations,Microsoft.Security/tasks/read,Gets all available security recommendations,user,False
Microsoft Security,Security Recommendations,Get security recommendations,Microsoft.Security/locations/tasks/read,Gets all available security recommendations,user,False
Microsoft Security,Security Recommendations,Resolve Recommendation,Microsoft.Security/locations/tasks/resolve/action,Resolve a security recommendation,user,False
Microsoft Security,Security Recommendations,Start Recommendation,Microsoft.Security/locations/tasks/start/action,Start a security recommendation,user,False
Microsoft Security,Security Solutions,Create or Update Security Solutions,Microsoft.Security/securitySolutions/write,Creates a new security solution or updates an existing one,user,False
Microsoft Security,Security Solutions,Create or Update Security Solutions,Microsoft.Security/locations/securitySolutions/write,Creates a new security solution or updates an existing one,user,False
Microsoft Security,Security Solutions,Delete Security Solutions,Microsoft.Security/securitySolutions/delete,Deletes a security solution,user,False
Microsoft Security,Security Solutions,Delete Security Solutions,Microsoft.Security/locations/securitySolutions/delete,Deletes a security solution,user,False
Microsoft Security,Security Solutions,Get Security Solutions,Microsoft.Security/securitySolutions/read,Gets the security solutions,user,False
Microsoft Security,Security Solutions,Get Security Solutions,Microsoft.Security/locations/securitySolutions/read,Gets the security solutions,user,False
Microsoft Security,Security Statuses Summaries,Get security statuses summaries,Microsoft.Security/securityStatusesSummaries/read,Gets the security statuses summaries for the scope,user,False
Microsoft Security,Security custom recommendations,Create custom recommendations,Microsoft.Security/customRecommendations/write,Create or update the custom recommendation,user,False
Microsoft Security,Security custom recommendations,Delete custom recommendations,Microsoft.Security/customRecommendations/delete,Deletes the custom recommendation,user,False
Microsoft Security,Security custom recommendations,Get custom recommendations,Microsoft.Security/customRecommendations/read,Get the custom recommendations,user,False
Microsoft Security,Security standardAssignments,Create security standard assignments,Microsoft.Security/standardAssignments/write,Create or update the standard assignment,user,False
Microsoft Security,Security standardAssignments,Delete security standard assignments,Microsoft.Security/standardAssignments/delete,Deletes the standard assignment,user,False
Microsoft Security,Security standardAssignments,Get security standard assignments,Microsoft.Security/standardAssignments/read,Get the standard assignments,user,False
Microsoft Security,Security standards,Create security standards,Microsoft.Security/securityStandards/write,Create or update the security standard,user,False
Microsoft Security,Security standards,Delete security standards,Microsoft.Security/securityStandards/delete,Deletes the security standard,user,False
Microsoft Security,Security standards,Get security standards,Microsoft.Security/securityStandards/read,Get the security standards,user,False
Microsoft Security,Sensitivity Settings,Get sensitivity settings,Microsoft.Security/sensitivitySettings/read,Gets tenant level sensitivity settings,user,False
Microsoft Security,Sensitivity Settings,Update sensitivity settings,Microsoft.Security/sensitivitySettings/write,Updates tenant level sensitivity settings,user,False
Microsoft Security,Server Vulnerability Assessments,Create or Update server vulnerability assessments,Microsoft.Security/serverVulnerabilityAssessments/write,Create or update a server vulnerability assessments solution on resource,user,False
Microsoft Security,Server Vulnerability Assessments,Delete server vulnerability assessments,Microsoft.Security/serverVulnerabilityAssessments/delete,Remove a server vulnerability assessments solution from a resource,user,False
Microsoft Security,Server Vulnerability Assessments,Get server vulnerability assessments,Microsoft.Security/serverVulnerabilityAssessments/read,Get server vulnerability assessments onboarding status on a given resource,user,False
Microsoft Security,Server Vulnerability Assessments Settings,Create or Update server vulnerability assessments settings,Microsoft.Security/serverVulnerabilityAssessmentsSettings/write,Create or update server vulnerability assessments settings on a given subscription,user,False
Microsoft Security,Server Vulnerability Assessments Settings,Delete server vulnerability assessments settings,Microsoft.Security/serverVulnerabilityAssessmentsSettings/delete,Remove server vulnerability assessments settings from a given subscription,user,False
Microsoft Security,Server Vulnerability Assessments Settings,Get server vulnerability assessments settings,Microsoft.Security/serverVulnerabilityAssessmentsSettings/read,Get server vulnerability assessments settings onboarding status for a given subscription,user,False
Microsoft Security,Settings,Get settings,Microsoft.Security/settings/read,Gets the settings for the scope,user,False
Microsoft Security,Settings,Update settings,Microsoft.Security/settings/write,Updates the settings for the scope,user,False
Microsoft Security,Sub Assessments,Create sub assessment,Microsoft.Security/assessments/subAssessments/write,Create or update security sub assessments on your subscription,user,False
Microsoft Security,Sub Assessments,Get sub assessments,Microsoft.Security/assessments/subAssessments/read,Get security sub assessments on your subscription,user,False
Microsoft Security,Subscription,Register Subscription,Microsoft.Security/register/action,Registers the subscription for Azure Security Center,user,False
Microsoft Security,Subscription,Unregister Subscription,Microsoft.Security/unregister/action,Unregisters the subscription from Azure Security Center,user,False
Microsoft Security,Web Application Firewalls,Create or Update Web Application Firewalls,Microsoft.Security/webApplicationFirewalls/write,Creates a new web application firewall or updates an existing one,user,False
Microsoft Security,Web Application Firewalls,Delete Security Web Application Firewalls,Microsoft.Security/webApplicationFirewalls/delete,Deletes a web application firewall,user,False
Microsoft Security,Web Application Firewalls,Get Web Application Firewalls,Microsoft.Security/webApplicationFirewalls/read,Gets the web application firewalls,user,False
Microsoft Security,Workspace Settings,Delete workspace settings,Microsoft.Security/workspaceSettings/delete,Deletes the workspace settings,user,False
Microsoft Security,Workspace Settings,Get workspace settings,Microsoft.Security/workspaceSettings/read,Gets the workspace settings,user,False
Microsoft Security,Workspace Settings,Reconnect vms from system workspaces,Microsoft.Security/workspaceSettings/connect/action,Change workspace settings reconnection settings,user,False
Microsoft Security,Workspace Settings,Update workspace settings,Microsoft.Security/workspaceSettings/write,Updates the workspace settings,user,False
